<?xml version='1.0' encoding='UTF-8'?>
<?xml-stylesheet type='text/xsl' href='/style/human.xsl'?>
<extension xmlns='http://rs.gbif.org/extension/'
    xmlns:xsi='http://www.w3.org/2001/XMLSchema-instance'
    xmlns:dc='http://purl.org/dc/terms/'
    xsi:schemaLocation='http://rs.gbif.org/extension/ http://rs.gbif.org/schema/extension.xsd'
    dc:title='Darwin Core Resource Relationship'
    name='ResourceRelationship' namespace='http://rs.tdwg.org/dwc/terms/'
    rowType='http://rs.tdwg.org/dwc/terms/ResourceRelationship'
    dc:issued='2025-06-12'
    dc:subject='dwc:Occurrence dwc:Event dwc:Taxon'
    dc:relation='http://rs.tdwg.org/dwc/terms/ResourceRelationship'
    dc:description='Extended support for relationships between resources in a Darwin Core Occurrence, Event, or Taxon Core to resources in an extension or external to the data set. The identifiers for subject (resourceID) and object (relatedResourceID) may exist in the dataset or be accessible via an externally resolvable identifiers.'>

    <!-- ResourceRelationship -->
    <property group='ResourceRelationship' name='resourceRelationshipID' namespace='http://rs.tdwg.org/dwc/terms/' qualName='http://rs.tdwg.org/dwc/terms/resourceRelationshipID' dc:relation='https://dwc.tdwg.org/terms/#dwc:resourceRelationshipID' dc:description='An identifier for an instance of relationship between one resource (the subject) and another (dwc:relatedResource, the object).' comments='' examples='`04b16710-b09c-11e8-96f8-529269fb1459`' required='false'/>
    <property group='ResourceRelationship' name='resourceID' namespace='http://rs.tdwg.org/dwc/terms/' qualName='http://rs.tdwg.org/dwc/terms/resourceID' dc:relation='https://dwc.tdwg.org/terms/#dwc:resourceID' dc:description='An identifier for the resource that is the subject of the relationship.' comments='' examples='`f809b9e0-b09b-11e8-96f8-529269fb1459`' required='true'/>
    <property group='ResourceRelationship' name='relationshipOfResourceID' namespace='http://rs.tdwg.org/dwc/terms/' qualName='http://rs.tdwg.org/dwc/terms/relationshipOfResourceID' dc:relation='https://dwc.tdwg.org/terms/#dwc:relationshipOfResourceID' dc:description='An identifier for the relationship type (predicate) that connects the subject identified by dwc:resourceID to its object identified by dwc:relatedResourceID.' comments='Recommended best practice is to use the identifiers of the terms in a controlled vocabulary, such as the OBO Relation Ontology.' examples='`http://purl.obolibrary.org/obo/RO_0002456` (for the relation `pollinated by`); `http://purl.obolibrary.org/obo/RO_0002455` (for the relation `pollinates`); `https://www.inaturalist.org/observation_fields/879` (for the relation `eaten by`)' required='false'/>
    <property group='ResourceRelationship' name='relatedResourceID' namespace='http://rs.tdwg.org/dwc/terms/' qualName='http://rs.tdwg.org/dwc/terms/relatedResourceID' dc:relation='https://dwc.tdwg.org/terms/#dwc:relatedResourceID' dc:description='An identifier for a related resource (the object, rather than the subject of the relationship).' comments='' examples='`dc609808-b09b-11e8-96f8-529269fb1459`' required='true'/>
    <property group='ResourceRelationship' name='relationshipOfResource' namespace='http://rs.tdwg.org/dwc/terms/' qualName='http://rs.tdwg.org/dwc/terms/relationshipOfResource' dc:relation='https://dwc.tdwg.org/terms/#dwc:relationshipOfResource' dc:description='The relationship of the subject (identified by dwc:resourceID) to the object (identified by dwc:relatedResourceID).' comments='Recommended best practice is to use a controlled vocabulary.' examples='`same as`; `duplicate of`; `mother of`; `offspring of`; `sibling of`; `parasite of`; `host of`; `valid synonym of`; `located within`; `pollinator of members of taxon`; `pollinated specific plant`; `pollinated by members of taxon`; `on slab with`' required='false'/>
    <property group='ResourceRelationship' name='relationshipAccordingTo' namespace='http://rs.tdwg.org/dwc/terms/' qualName='http://rs.tdwg.org/dwc/terms/relationshipAccordingTo' dc:relation='https://dwc.tdwg.org/terms/#dwc:relationshipAccordingTo' dc:description='The source (person, organization, publication, reference) establishing the relationship between the two resources.' comments='' examples='`Julie Woodruff`' required='false'/>
    <property group='ResourceRelationship' name='relationshipEstablishedDate' namespace='http://rs.tdwg.org/dwc/terms/' qualName='http://rs.tdwg.org/dwc/terms/relationshipEstablishedDate' dc:relation='https://dwc.tdwg.org/terms/#dwc:relationshipEstablishedDate' dc:description='The date-time on which the relationship between the two resources was established.' comments='Recommended best practice is to use a date that conforms to ISO 8601-1:2019.' examples='`1963-03-08T14:07-06:00` (8 Mar 1963 at or after 2:07pm and before 2:08pm in the time zone six hours earlier than UTC); `2009-02-20T08:40Z` (20 February 2009 at or after 8:40am and before 8:41 UTC); `2018-08-29T15:19` (29 August 2018 at or after 3:19pm and before 3:20pm local time); `1809-02-12` (within the day 12 February 1809); `1906-06` (in the month of June 1906); `1971` (in the year 1971); `2007-03-01T13:00:00Z/2008-05-11T15:30:00Z` (some time within the interval beginning 1 March 2007 at 1pm UTC and before 11 May 2008 at 3:30pm UTC); `1900/1909` (some time within the interval between the beginning of the year 1900 and before the year 1909); `2007-11-13/15` (some time in the interval between the beginning of 13 November 2007 and before 15 November 2007)' required='false'/>
    <property group='ResourceRelationship' name='relationshipRemarks' namespace='http://rs.tdwg.org/dwc/terms/' qualName='http://rs.tdwg.org/dwc/terms/relationshipRemarks' dc:relation='https://dwc.tdwg.org/terms/#dwc:relationshipRemarks' dc:description='Comments or notes about the relationship between the two resources.' comments='' examples='`mother and offspring collected from the same nest`; `pollinator captured in the act`' required='false'/>
</extension>