<?xml version="1.0" encoding="UTF-8"?>
<?xml-stylesheet type="text/xsl" href="/style/human.xsl"?>
<extension xmlns="http://rs.gbif.org/extension/"
    xmlns:xsi="http://www.w3.org/2001/XMLSchema-instance" 
    xmlns:dc="http://purl.org/dc/terms/"    
    xsi:schemaLocation="http://rs.gbif.org/extension/ http://rs.gbif.org/schema/extension.xsd"
    rowType="http://rs.gbif.org/terms/1.0/TypesAndSpecimen"
    dc:issued="2026-03-09"
    dc:title="Types and Specimen" name="TypesAndSpecimen" namespace="http://rs.gbif.org/terms/1.0"
    dc:subject="dwc:Taxon"
    dc:relation="http://rs.gbif.org/extension/gbif/1.0/typesandspecimen.xml"
    dc:description="An extension for specimens and types, including type specimens, type species and type genera and simple specimens unrelated to types.">
    
    <property name='typeStatus' namespace='http://rs.tdwg.org/dwc/terms/' qualName='http://rs.tdwg.org/dwc/terms/typeStatus' thesaurus="http://rs.gbif.org/vocabulary/gbif/type_status.xml" dc:relation='' dc:description='The type status of the specimen, not used for type species or type genus' examples='holotype, syntype, lectotype, type species' required='false'/>
    <property name='typeDesignationType' namespace='http://rs.gbif.org/terms/1.0/' qualName='http://rs.gbif.org/terms/1.0/typeDesignationType' thesaurus="http://rs.gbif.org/vocabulary/gbif/type_designation_type.xml" dc:relation='' dc:description='The reason why this specimen or name is designated as a type.' examples='monotypy, original designation, tautonomy' required='false'/>
    <property name='typeDesignatedBy' namespace='http://rs.gbif.org/terms/1.0/' qualName='http://rs.gbif.org/terms/1.0/typeDesignatedBy' dc:relation='' dc:description='The citation of the publication where the type designation is found' examples='Vachal, J. (1897) Éclaircissements sur de genre Scrapter et description d’une espéce nouvelle de Dufourea. Bulletin de la Société Entomologique de France, 1897, 61–64.' required='false'/>
    <property name='scientificName' namespace='http://rs.tdwg.org/dwc/terms/' qualName='http://rs.tdwg.org/dwc/terms/scientificName' dc:relation='' dc:description='In case of type specimens the scientific name originally used on the label. Not necessarily the same as the currently recognized name. In case of type species or genera it should be the species or genus name that typifies the higher taxon.' examples='Ctenomys sociabilis" "Roptrocerus typographi (Györfi, 1952)" ' required='false'/>
    <property name='taxonRank' namespace='http://rs.tdwg.org/dwc/terms/' qualName='http://rs.tdwg.org/dwc/terms/taxonRank' dc:relation='' dc:description='The rank of the taxon bearing the scientific name' examples='species, genus, subspecies' required='false'/>
    <property name='bibliographicCitation' namespace='http://purl.org/dc/terms/' qualName='http://purl.org/dc/terms/bibliographicCitation' dc:relation='' dc:description='A text string citating the described specimen. Often found in taxonomic treatments and frequently based on institution code and catalog number.' examples='Iraq: Mosul: Jabal Khantur prope Sharanish N. Zakho, in fissures rupium calc., 1200 m, Rech. 12083 (W!).' required='false'/>
    <property name='occurrenceID' namespace='http://rs.tdwg.org/dwc/terms/' qualName='http://rs.tdwg.org/dwc/terms/occurrenceID' dc:relation='' dc:description='An identifier for the specimen, preferably a resolvable globally unique identifier.' examples='' required='false'/>
    <property name='institutionCode' namespace='http://rs.tdwg.org/dwc/terms/' qualName='http://rs.tdwg.org/dwc/terms/institutionCode' dc:relation='' dc:description='The name (or acronym) in use by the institution having custody of the object(s) or information referred to in the record.' examples='"MVZ", "FMNH", "AKN-CLO", "University of California Museum of Paleontology (UCMP)"' required='false'/>
    <property name='institutionID' namespace='http://rs.tdwg.org/dwc/terms/' qualName='http://rs.tdwg.org/dwc/terms/institutionID' dc:relation='' dc:description='An identifier for the institution having custody of the object(s) or information referred to in the record.' examples='"https://ror.org/015hz7p22", "http://grscicoll.org/institution/museum-southwestern-biology", "https://www.gbif.org/grscicoll/institution/e3d4dcc4-81e2-444c-8a5c-41d1044b5381"' required='false'/>
    <property name='collectionCode' namespace='http://rs.tdwg.org/dwc/terms/' qualName='http://rs.tdwg.org/dwc/terms/collectionCode' dc:relation='' dc:description='The name, acronym, coden, or initialism identifying the collection or data set from which the record was derived.' examples='"Mammals", "Hildebrandt", "eBird"' required='false'/>
    <property name='collectionID' namespace='http://rs.tdwg.org/dwc/terms/' qualName='http://rs.tdwg.org/dwc/terms/collectionID' dc:relation='' dc:description='An identifier for the collection or dataset from which the record was derived.' examples='"https://scientific-collections.gbif.org/collection/fbd3ed74-5a21-4e01-b86a-33d36f032d9c"' required='false'/>    
    <property name='catalogNumber' namespace='http://rs.tdwg.org/dwc/terms/' qualName='http://rs.tdwg.org/dwc/terms/catalogNumber' dc:relation='' dc:description='An identifier (preferably unique) for the record within the data set or collection.' examples='"2008.1334", "145732a", "145732"' required='false'/>
    <property name='locality' namespace='http://rs.tdwg.org/dwc/terms/' qualName='http://rs.tdwg.org/dwc/terms/locality' dc:relation='' dc:description='The location where the the specimen was collected. In case of type specimens the type locality.' examples='Iraq: Mosul: Jabal Khantur prope Sharanish N. Zakho, in fissures rupium calc., 1200 m' required='false'/>
    <property name='sex' namespace='http://rs.tdwg.org/dwc/terms/' qualName='http://rs.tdwg.org/dwc/terms/sex' dc:relation='' dc:description='The sex of the specimen being referenced.' examples='male' required='false'/>
    <property name='recordedBy' namespace='http://rs.tdwg.org/dwc/terms/' qualName='http://rs.tdwg.org/dwc/terms/recordedBy' dc:relation='' dc:description='The primary collector or observer, especially one who applies a personal identifier (recordNumber), should be listed first.' examples='KH Rechinger' required='false'/>
    <property name='source' namespace='http://purl.org/dc/terms/' qualName='http://purl.org/dc/terms/source' dc:relation='' dc:description='' examples='' required='false'/>
    <property name='verbatimEventDate' namespace='http://rs.tdwg.org/dwc/terms/' qualName='http://rs.tdwg.org/dwc/terms/verbatimEventDate' dc:relation='' dc:description='The date when the specimen was collected' examples='"spring 1910", "Marzo 2002", "1999-03-XX", "17IV1934"' required='false'/>
    <property name='verbatimLabel' namespace='http://rs.gbif.org/terms/1.0/' qualName='http://rs.gbif.org/terms/1.0/verbatimLabel' dc:relation='' dc:description='The full, verbatim text from the specimen label' examples='' required='false'/>
    <property name='verbatimLongitude' namespace='http://rs.tdwg.org/dwc/terms/' qualName='http://rs.tdwg.org/dwc/terms/verbatimLongitude' dc:relation='' dc:description='The geographic longitude ' examples="121d 10' 34 W" required='false'/>
    <property name='verbatimLatitude' namespace='http://rs.tdwg.org/dwc/terms/' qualName='http://rs.tdwg.org/dwc/terms/verbatimLatitude' dc:relation='' dc:description='The geographic latitude ' examples='41 05 54.03S' required='false'/>
    <property name='datasetID' namespace='http://rs.tdwg.org/dwc/terms/' qualName='http://rs.tdwg.org/dwc/terms/datasetID' dc:relation='http://rs.tdwg.org/dwc/terms/index.htm#datasetID' dc:description='An identifier for a subset of data.' examples='' required='false'/>
    
</extension>
